{
  "schema_version": 1,
  "message_id": "01950000-0000-7000-8000-000000002001",
  "correlation_id": "run:01950000-0000-7000-8000-000000000101",
  "sent_at": "2026-03-09T12:00:00Z",
  "type": "stream",
  "run_id": "01950000-0000-7000-8000-000000000101",
  "seq": 3,
  "kind": "log",
  "text": "Reading the packet for the enrich skill.",
  "ts": "2026-03-09T12:00:01Z"
}
